{
  "schema": "akos.brain.v1",
  "name": "Sample Research Brain",
  "workspace_root": "/workspace/sample-brain",
  "host": "neutral",
  "profiles": [
    "akos.core8.coordinator",
    "akos.core8.context-curator",
    "akos.core8.evidence-analyst"
  ],
  "governance": {
    "local_first": true,
    "no_write_back": true,
    "human_effect_gates": true,
    "provider_neutral": true
  },
  "review_status": "review-required",
  "verified": false
}
